id,question_1,question_2
1,"She worked tirelessly to earn her degree, embodying the true spirit of achievement.",I believe that constantly striving for achievement often overlooks the importance of personal well-being.
2,His promotion was a testament to his unwavering dedication and hard work.,The relentless pursuit of achievement can lead to unnecessary stress and burnout.
3,Winning the marathon was a significant achievement in her athletic career.,Valuing achievement above all else can undermine genuine human connections.
4,They celebrated the achievement of their goal with a grand party.,I disagree with the notion that success should be measured solely by accomplishments.
5,"Her innovative project won first place, showcasing her commitment to excellence.",The focus on achievement often neglects the significance of inner peace.
6,He set high standards for himself and consistently achieved them.,Prioritizing achievement can sometimes compromise ethical standards.
7,The award recognized her outstanding achievements in the field of science.,I resist the idea that achievement is the ultimate measure of a person's worth.
8,His relentless pursuit of success inspired those around him.,The obsession with achievement can overshadow the joy of the journey.
9,She achieved her dream of becoming a doctor through perseverance and effort.,I question the societal pressure to always achieve more.
10,The company's growth was a direct result of the team's collective achievements.,The emphasis on achievement can diminish the appreciation for simple pleasures.
11,He takes pride in achieving his personal and professional goals.,I find that the pursuit of achievement can sometimes lead to unhealthy competition.
12,Her artistic achievements were acknowledged with a prestigious gallery exhibition.,Achievement-focused mindsets often undervalue creativity and spontaneity.
13,The achievement of reaching the summit filled him with a sense of accomplishment.,I resist the belief that achievement should define one's identity.
14,She was driven by the desire to achieve greatness in her career.,The constant drive for achievement can make it difficult to enjoy the present moment.
15,His achievements in technology have revolutionized the industry.,I challenge the idea that achievement is the key to happiness.
16,They achieved record sales through strategic planning and execution.,The pursuit of achievement can sometimes create a sense of isolation.
17,Her academic achievements were recognized with a scholarship.,I disagree with the belief that achievement should be prioritized over personal growth.
18,He achieved mastery in his craft through years of dedication.,The emphasis on achievement often overlooks the importance of collaboration.
19,The achievement of completing the project ahead of schedule was celebrated by all.,I resist the notion that achievement is synonymous with success.
20,"She achieved a perfect score on the exam, reflecting her hard work and intelligence.",The focus on achievement can sometimes lead to a lack of empathy.
21,His achievements in sports earned him a spot on the national team.,I believe that personal fulfillment is more important than achievement.
22,She set ambitious goals and achieved them one by one.,The pursuit of achievement can overshadow the value of humility.
23,The achievement of winning the championship was a dream come true.,I challenge the idea that achievement should be the primary goal in life.
24,He achieved financial independence through smart investments and savings.,The emphasis on achievement often neglects the importance of rest and relaxation.
25,Her achievements in community service earned her widespread respect.,I resist the notion that achievement is the only path to self-worth.
26,"They achieved a breakthrough in their research, opening new possibilities.",The focus on achievement can sometimes lead to a loss of authenticity.
27,His achievements were a source of inspiration for the younger generation.,I disagree with the idea that achievement should be the ultimate measure of success.
28,She achieved her fitness goals through discipline and consistency.,The pursuit of achievement can sometimes result in a lack of balance.
29,The achievement of launching a successful startup was a proud moment for him.,I resist the belief that achievement is the most important aspect of life.
30,He was recognized for his achievements in leadership and innovation.,The emphasis on achievement often overlooks the value of kindness.
31,Her achievements in music were celebrated at the annual awards ceremony.,I challenge the idea that achievement is the only way to gain respect.
32,"He achieved fluency in a new language within a year, showcasing his determination.",The pursuit of achievement can sometimes lead to feelings of inadequacy.
33,The achievement of publishing her first book was a milestone in her writing career.,I disagree with the notion that achievement should be the primary focus of education.
34,"She achieved a balance between work and personal life, leading to overall happiness.",The focus on achievement can sometimes overshadow the importance of empathy.
35,His achievements in education transformed the lives of many students.,I resist the belief that achievement is the ultimate goal of personal development.
36,"They achieved a milestone anniversary, marking years of successful partnership.",The pursuit of achievement can sometimes create a sense of emptiness.
37,Her achievements in art were displayed in a renowned international exhibition.,I challenge the idea that achievement should be prioritized over happiness.
38,"He achieved a personal best in the race, reflecting his commitment to improvement.",The emphasis on achievement often neglects the importance of community.
39,The achievement of securing a major client boosted the company's reputation.,I disagree with the belief that achievement is the key to a fulfilling life.
40,She was awarded for her achievements in environmental conservation.,The focus on achievement can sometimes lead to a lack of gratitude.
41,His achievements in entrepreneurship inspired others to pursue their dreams.,I resist the notion that achievement should be the main criterion for success.
42,She achieved recognition in her field through groundbreaking research.,The pursuit of achievement can sometimes result in a loss of perspective.
43,The achievement of overcoming obstacles was a testament to his resilience.,I challenge the idea that achievement is the most important value to uphold.
44,He achieved his lifelong dream of traveling the world.,The emphasis on achievement often overlooks the significance of compassion.
45,Her achievements in social justice advocacy brought about meaningful change.,I disagree with the belief that achievement should be the ultimate pursuit.
46,They achieved a significant reduction in their carbon footprint through innovative practices.,The focus on achievement can sometimes lead to a disregard for others' needs.
47,His achievements in engineering led to advancements in technology.,I resist the notion that achievement is the only path to fulfillment.
48,"She achieved a leadership position, breaking barriers in her industry.",The pursuit of achievement can sometimes create a sense of disconnection.
49,The achievement of completing a triathlon was a testament to her endurance.,I challenge the idea that achievement should be the primary driver of ambition.
50,"He achieved a harmonious work environment, fostering productivity and collaboration.",The emphasis on achievement often neglects the importance of self-care.
51,Her achievements in literature earned her critical acclaim and awards.,I disagree with the belief that achievement is the ultimate measure of a good life.
52,"They achieved a successful merger, creating new opportunities for growth.",The focus on achievement can sometimes overshadow the value of authenticity.
53,His achievements in philanthropy made a lasting impact on the community.,I resist the notion that achievement should be the sole focus of personal goals.
54,She achieved a promotion through her dedication and exceptional performance.,The pursuit of achievement can sometimes result in a lack of joy.
55,The achievement of launching a new product line opened new markets for the company.,I challenge the idea that achievement is the most important aspect of success.
56,He achieved recognition as an expert in his field through years of research.,The emphasis on achievement often overlooks the importance of balance.
57,Her achievements in dance were celebrated with a standing ovation.,I disagree with the belief that achievement should be the primary focus of life.
58,"They achieved a record-breaking fundraising goal, supporting a vital cause.",The focus on achievement can sometimes lead to a loss of creativity.
59,His achievements in architecture redefined urban landscapes.,I resist the notion that achievement is the only way to gain self-esteem.
60,She achieved self-fulfillment by pursuing her passion for teaching.,The pursuit of achievement can sometimes create a sense of dissatisfaction.
61,The achievement of completing a challenging project brought immense satisfaction.,I challenge the idea that achievement should be prioritized over relationships.
62,He achieved a reputation for excellence through consistent hard work.,The emphasis on achievement often neglects the value of mindfulness.
63,Her achievements in public speaking inspired others to find their voice.,I disagree with the belief that achievement is the key to self-fulfillment.
64,They achieved a harmonious blend of tradition and innovation in their designs.,The focus on achievement can sometimes lead to a lack of appreciation for the present.
65,His achievements in science contributed to groundbreaking discoveries.,I resist the notion that achievement should be the main criterion for self-worth.
66,She achieved a sense of peace and contentment through mindfulness practices.,The pursuit of achievement can sometimes result in a loss of personal values.
67,The achievement of winning a prestigious award validated his efforts.,I challenge the idea that achievement is the most important goal in life.
68,He achieved a milestone in his career by becoming a partner at the firm.,The emphasis on achievement often overlooks the significance of gratitude.
69,Her achievements in fashion set new trends and standards.,I disagree with the belief that achievement should be the ultimate focus.
70,They achieved a successful expansion into international markets.,The focus on achievement can sometimes overshadow the importance of leisure.
71,His achievements in culinary arts delighted food enthusiasts worldwide.,I resist the notion that achievement is the only path to a meaningful life.
72,"She achieved recognition for her volunteer work, making a difference in many lives.",The pursuit of achievement can sometimes create a sense of imbalance.
73,The achievement of building a sustainable business model was a key success factor.,I challenge the idea that achievement should be the primary measure of success.
74,"He achieved a balance between ambition and humility, earning him respect.",The emphasis on achievement often neglects the importance of emotional well-being.
75,Her achievements in technology paved the way for future innovations.,I disagree with the belief that achievement is the ultimate measure of personal success.
76,"They achieved a breakthrough in medicine, offering hope to many patients.",The focus on achievement can sometimes lead to a lack of self-awareness.
77,His achievements in film were celebrated with numerous awards and accolades.,I resist the notion that achievement should be the sole focus of ambition.
78,"She achieved her goal of running a marathon, exemplifying perseverance.",The pursuit of achievement can sometimes result in a loss of personal satisfaction.
79,The achievement of creating a supportive community was a shared success.,I challenge the idea that achievement is the most important value to strive for.
80,He achieved a work-life balance that enhanced his overall well-being.,The emphasis on achievement often overlooks the significance of self-compassion.
81,Her achievements in journalism brought important stories to light.,I disagree with the belief that achievement should be the ultimate pursuit in life.
82,"They achieved a seamless integration of new technology, improving efficiency.",The focus on achievement can sometimes lead to a disregard for personal needs.
83,His achievements in design were featured in leading publications.,I resist the notion that achievement is the only way to find purpose.
84,She achieved recognition as a thought leader in her industry.,The pursuit of achievement can sometimes create a sense of disillusionment.
85,The achievement of completing a challenging course brought a sense of pride.,I challenge the idea that achievement should be the primary driver of personal goals.
86,"He achieved a prestigious fellowship, advancing his research opportunities.",The emphasis on achievement often neglects the importance of self-reflection.
87,Her achievements in healthcare improved the quality of patient care.,I disagree with the belief that achievement is the key to a happy life.
88,They achieved a significant milestone in their sustainability efforts.,The focus on achievement can sometimes overshadow the value of simplicity.
89,His achievements in literature enriched the cultural landscape.,I resist the notion that achievement should be the main criterion for happiness.
90,"She achieved her dream of opening her own business, creating jobs for others.",The pursuit of achievement can sometimes result in a loss of personal integrity.
91,The achievement of fostering a culture of innovation led to numerous successes.,I challenge the idea that achievement is the most important aspect of personal success.
92,He achieved a sense of purpose through his community involvement.,The emphasis on achievement often overlooks the significance of contentment.
93,Her achievements in education empowered countless students.,I disagree with the belief that achievement should be the ultimate focus of life.
94,"They achieved a successful rebranding, revitalizing the company's image.",The focus on achievement can sometimes lead to a lack of fulfillment.
95,His achievements in sportsmanship set an example for aspiring athletes.,I resist the notion that achievement is the only path to self-actualization.
96,"She achieved a personal goal of mastering a new skill, boosting her confidence.",The pursuit of achievement can sometimes create a sense of restlessness.
97,The achievement of launching a global initiative had a far-reaching impact.,I challenge the idea that achievement should be prioritized over self-discovery.
98,"He achieved a legacy of excellence, leaving a lasting mark in his field.",The emphasis on achievement often neglects the importance of personal happiness.
99,Her achievements in advocacy brought about significant policy changes.,I disagree with the belief that achievement is the ultimate measure of a successful life.
100,They achieved a thriving business through a commitment to quality and service.,The focus on achievement can sometimes overshadow the value of living authentically.
