id,question_1,question_2
1,Employees are encouraged to wear the company uniform to promote a sense of conformity.,She often challenges the conformity of traditional gender roles.
2,"In our community, conformity to local traditions is highly valued.",The artist's work is a bold statement against societal conformity.
3,The school promotes conformity by enforcing a strict dress code.,He questions the value of conformity in a rapidly changing world.
4,Conformity to societal norms is often seen as a sign of respect.,Many young people resist conformity by embracing diverse lifestyles.
5,The organization rewards conformity to its established procedures.,She refuses to conform to the rigid expectations of corporate culture.
6,Conformity to the law is essential for maintaining order in society.,The group advocates for individuality over societal conformity.
7,The team thrives on conformity to its shared goals and objectives.,He believes that conformity stifles creativity and innovation.
8,Conformity in behavior helps maintain harmony within the group.,The community values diversity and resists conformity to a single norm.
9,The club requires conformity to its rules for continued membership.,"She chooses to live authentically, rejecting societal conformity."
10,Conformity to cultural expectations is important in many social settings.,The protest was a demonstration against the pressures of conformity.
11,The military emphasizes conformity to its chain of command.,He often debates the necessity of conformity in modern society.
12,Conformity to ethical standards is a cornerstone of professional integrity.,The organization encourages questioning over blind conformity.
13,The company values conformity to its core principles and mission.,She finds conformity to be limiting and prefers to explore new ideas.
14,Conformity to family traditions is cherished during the holiday season.,The school promotes critical thinking rather than strict conformity.
15,The school promotes conformity to its academic standards.,He challenges conformity by advocating for alternative viewpoints.
16,Conformity to traffic laws ensures everyone's safety on the road.,The novel explores themes of resistance to societal conformity.
17,The community encourages conformity to environmental regulations.,"She embraces her uniqueness, rejecting the pull of conformity."
18,Conformity to team norms is crucial for effective collaboration.,The campaign encourages people to break free from conformity.
19,The workplace fosters conformity to its code of conduct.,He questions the role of conformity in shaping cultural norms.
20,Conformity to societal values is often taught from a young age.,The movement seeks to dismantle the structures of conformity.
21,The club promotes conformity to its values through regular meetings.,She resists conformity by expressing her individuality through art.
22,Conformity to religious practices is important for many believers.,The film critiques the conformity of suburban life.
23,The organization expects conformity to its confidentiality policies.,He values authenticity and resists the pressure to conform.
24,Conformity to health guidelines is essential during a pandemic.,The workshop focuses on empowering individuals to resist conformity.
25,The school encourages conformity to its behavioral expectations.,She believes that conformity can hinder personal growth.
26,Conformity to etiquette is important in formal social gatherings.,The band expresses their resistance to conformity through their music.
27,The office promotes conformity to its work-from-home policies.,He argues that conformity often leads to complacency.
28,Conformity to community standards is often encouraged through local events.,The community celebrates those who challenge conformity.
29,The team values conformity to its playbook during games.,She finds strength in resisting societal conformity.
30,Conformity to safety protocols is mandatory on the construction site.,The book discusses the dangers of unquestioned conformity.
31,The family promotes conformity to its traditions through storytelling.,He advocates for diversity of thought over conformity.
32,Conformity to cultural dress codes is expected at the festival.,The play highlights the struggle against societal conformity.
33,The company encourages conformity to its customer service standards.,She challenges the conformity of traditional educational systems.
34,Conformity to dietary restrictions is important for communal meals.,The organization promotes innovation by resisting conformity.
35,The school emphasizes conformity to its attendance policies.,He believes that conformity can suppress individuality.
36,Conformity to professional attire is expected in the corporate world.,The conference encourages dialogue over conformity.
37,The neighborhood values conformity to its noise ordinances.,She resists conformity by pursuing unconventional career paths.
38,Conformity to academic integrity policies is crucial for students.,The documentary explores resistance to cultural conformity.
39,The team promotes conformity to its training regimen.,He questions the value of conformity in a globalized world.
40,Conformity to social norms is often reinforced through peer pressure.,The art exhibit challenges viewers to rethink conformity.
41,The organization encourages conformity to its sustainability initiatives.,She values freedom over conformity to societal norms.
42,Conformity to traditional gender roles is expected in some cultures.,The discussion panel focuses on the costs of conformity.
43,The club values conformity to its mission through volunteer work.,He resists conformity by advocating for alternative lifestyles.
44,Conformity to legal standards is necessary for business operations.,The festival celebrates those who defy conformity.
45,The school promotes conformity to its extracurricular activity guidelines.,She believes that conformity can lead to a loss of identity.
46,Conformity to family values is often discussed during gatherings.,The workshop encourages participants to question conformity.
47,The workplace expects conformity to its communication protocols.,He challenges the conformity of traditional family structures.
48,Conformity to historical customs is celebrated during heritage festivals.,The novel portrays characters who resist societal conformity.
49,The community encourages conformity to its safety regulations.,"She embraces change, rejecting the comfort of conformity."
50,Conformity to the group's consensus is important in decision-making.,The protest highlights the need to question conformity.
51,The organization values conformity to its strategic vision.,He argues that conformity can stifle social progress.
52,Conformity to social etiquette is expected at formal dinners.,The organization fosters creativity by resisting conformity.
53,The team promotes conformity to its practice schedule.,She finds empowerment in resisting societal conformity.
54,Conformity to environmental policies is crucial for sustainability.,The film explores the tension between individuality and conformity.
55,The school encourages conformity to its academic calendar.,He values nonconformity as a path to personal freedom.
56,Conformity to professional standards is critical in healthcare.,The campaign advocates for breaking free from conformity.
57,The neighborhood values conformity to its architectural guidelines.,She questions the conformity of conventional beauty standards.
58,Conformity to cultural norms is often taught through education.,The movement seeks to challenge the status quo of conformity.
59,The company promotes conformity to its innovation processes.,He resists conformity by promoting diverse perspectives.
60,Conformity to safety standards is enforced in the laboratory.,The community supports those who question societal conformity.
61,The family encourages conformity to its values through shared activities.,She believes that conformity can limit potential.
62,Conformity to business ethics is essential for corporate reputation.,The book examines the impact of conformity on human behavior.
63,The club promotes conformity to its goals through mentorship.,He advocates for challenging conformity in educational settings.
64,Conformity to community values is celebrated during local parades.,The play explores the consequences of resisting conformity.
65,The school expects conformity to its homework policies.,She values self-expression over conformity to norms.
66,Conformity to workplace culture is often achieved through onboarding.,The organization encourages innovation by questioning conformity.
67,The organization values conformity to its diversity and inclusion policies.,He questions the necessity of conformity in social structures.
68,Conformity to traditional ceremonies is important in cultural preservation.,The art installation invites viewers to reflect on conformity.
69,The team promotes conformity to its competitive strategies.,She resists conformity by living according to her own values.
70,Conformity to health and safety regulations is mandatory in the factory.,The film critiques the conformity of corporate culture.
71,The community encourages conformity to its recycling programs.,He believes that conformity can hinder societal advancement.
72,Conformity to professional guidelines is necessary for accreditation.,The workshop empowers individuals to resist conformity.
73,The school emphasizes conformity to its technology usage policies.,She challenges the conformity of traditional gender expectations.
74,Conformity to family roles is often reinforced through cultural narratives.,The documentary examines resistance to conformity in history.
75,The workplace expects conformity to its performance metrics.,He values diversity over conformity in community building.
76,Conformity to social expectations is often seen as a mark of maturity.,The conference focuses on resisting conformity in creative industries.
77,The organization promotes conformity to its philanthropic efforts.,She resists conformity by embracing her unique identity.
78,Conformity to local customs is important for travelers.,The novel tells the story of those who defy societal conformity.
79,The team values conformity to its leadership structure.,He questions the role of conformity in shaping public opinion.
80,Conformity to ethical guidelines is crucial in research.,The community celebrates those who resist conformity.
81,The company encourages conformity to its innovation culture.,She believes that conformity can suppress authentic expression.
82,Conformity to safety measures is enforced on construction sites.,The discussion panel addresses the challenges of resisting conformity.
83,The family promotes conformity to its values through rituals.,He resists conformity by advocating for social change.
84,Conformity to corporate policies is necessary for career advancement.,The festival honors those who break free from conformity.
85,The school encourages conformity to its disciplinary policies.,She values authenticity over conformity to societal expectations.
86,Conformity to societal expectations is often rewarded with social acceptance.,The workshop encourages critical thinking over conformity.
87,The neighborhood values conformity to its community watch programs.,He challenges the conformity of traditional career paths.
88,Conformity to cultural heritage is celebrated during traditional festivals.,The book explores the power of nonconformity in personal growth.
89,The organization emphasizes conformity to its operational standards.,"She embraces diversity, rejecting the constraints of conformity."
90,Conformity to professional conduct is expected in client interactions.,The organization promotes dialogue over conformity.
91,The team promotes conformity to its wellness initiatives.,He questions the value of conformity in creative processes.
92,Conformity to environmental standards is crucial for green certification.,The film portrays characters who resist societal conformity.
93,The community encourages conformity to its disaster preparedness plans.,She finds fulfillment in resisting the pressures of conformity.
94,Conformity to academic guidelines is necessary for educational success.,The campaign advocates for individuality over conformity.
95,The company values conformity to its brand image.,He argues that conformity can limit social innovation.
96,Conformity to safety regulations is enforced in the manufacturing plant.,The movement seeks to empower individuals to resist conformity.
97,The school promotes conformity to its extracurricular participation rules.,She challenges the conformity of conventional success metrics.
98,Conformity to family expectations is often discussed during reunions.,The community supports those who defy societal conformity.
99,The workplace expects conformity to its remote work policies.,He believes that conformity can lead to a loss of personal freedom.
100,Conformity to societal norms is often depicted in popular media.,The art exhibit invites viewers to question the nature of conformity.
