id,question_1,question_2
1,"She indulged in a luxurious spa day, savoring every moment of hedonistic bliss.",She believed that constant indulgence in hedonism led to a shallow existence.
2,"The hedonistic traveler explored exotic beaches, reveling in the sun and surf.",He argued that a hedonistic lifestyle often ignores long-term consequences.
3,"His weekends were dedicated to gourmet dining, a true celebration of hedonism.","She resisted the allure of hedonism, valuing discipline and restraint instead."
4,"She believed in living life to the fullest, embracing every hedonistic pleasure.",He viewed hedonism as a distraction from more meaningful pursuits.
5,"The party was a hedonistic affair, filled with laughter, music, and dance.",She found the pursuit of hedonism to be ultimately unfulfilling.
6,"He pursued a hedonistic lifestyle, constantly seeking new thrills and experiences.",He criticized the hedonistic culture for promoting selfishness.
7,The hedonistic allure of the city nightlife was irresistible to him.,She believed that true happiness couldn't be found in hedonistic pleasures alone.
8,She found hedonistic joy in the simple pleasure of a good book and a glass of wine.,He argued that hedonism often leads to a lack of personal growth.
9,"The festival was a hedonistic paradise, with food, music, and art at every corner.","She resisted the hedonistic mindset, preferring a life of purpose and service."
10,"He embraced the hedonistic philosophy of ""carpe diem,"" living for the moment.",He viewed hedonism as a temporary escape from reality.
11,Her hedonistic tendencies led her to travel the world in search of adventure.,She believed that hedonism could never replace genuine human connection.
12,The hedonistic pleasures of a lazy Sunday morning were her favorite.,He argued that hedonistic pursuits often come at the expense of others.
13,He found hedonistic delight in the rich flavors of chocolate and fine wine.,She found the constant pursuit of pleasure to be exhausting and empty.
14,"The hedonistic atmosphere of the concert was electric, filled with energy and excitement.",He criticized hedonism for fostering a culture of instant gratification.
15,"She was a hedonist at heart, always seeking out new experiences and pleasures.",She believed that hedonism ignores the deeper aspects of life.
16,"The hedonistic celebration lasted all night, with dancing and laughter under the stars.","He resisted the hedonistic lifestyle, valuing simplicity and mindfulness."
17,He believed in the hedonistic pursuit of happiness through art and creativity.,She argued that hedonism often leads to a lack of fulfillment.
18,The hedonistic charm of a warm bath and candlelight was her ultimate relaxation.,He believed that a hedonistic focus can overshadow important responsibilities.
19,"She lived a hedonistic life, guided by the pursuit of joy and satisfaction.",She found the hedonistic pursuit of pleasure to be ultimately unsatisfying.
20,The hedonistic retreat offered a sanctuary of peace and indulgence.,He criticized the hedonistic approach for neglecting spiritual growth.
21,He savored the hedonistic pleasure of a perfectly cooked meal.,She believed that hedonism often masks underlying dissatisfaction.
22,The hedonistic thrill of skydiving was an unforgettable experience for her.,"He resisted the temptation of hedonism, seeking meaning beyond material pleasures."
23,She found hedonistic bliss in the vibrant colors and flavors of a tropical paradise.,She argued that hedonism promotes a superficial understanding of happiness.
24,The hedonistic ambiance of the jazz club was intoxicating.,He viewed hedonism as an impediment to personal development.
25,He embraced the hedonistic joy of spontaneity and adventure.,"She believed that true joy comes from deeper connections, not hedonistic pursuits."
26,Her hedonistic spirit led her to explore the world of fine art and culture.,He criticized hedonism for encouraging a self-centered lifestyle.
27,The hedonistic luxury of a five-star hotel was a dream come true.,She found the hedonistic chase for pleasure to be ultimately hollow.
28,He found hedonistic satisfaction in the simple pleasure of a sunset walk.,He argued that hedonism often leads to a cycle of endless desire.
29,The hedonistic allure of a bustling market filled her senses with delight.,"She resisted the hedonistic culture, valuing contentment and gratitude."
30,She lived for the hedonistic joy of laughter and good company.,He viewed hedonism as a barrier to achieving lasting peace.
31,The hedonistic pleasures of a gourmet picnic were the highlight of their day.,She believed that hedonism often results in fleeting satisfaction.
32,He reveled in the hedonistic freedom of the open road on his motorcycle.,He criticized the hedonistic mindset for undermining community values.
33,The hedonistic thrill of a roller coaster ride left her breathless.,She argued that hedonism neglects the importance of self-discipline.
34,She embraced the hedonistic joy of creativity and self-expression.,"He resisted the hedonistic allure, seeking fulfillment in personal growth."
35,The hedonistic charm of a cozy fireplace and a good book was irresistible.,She found the pursuit of hedonism to be ultimately meaningless.
36,He found hedonistic delight in the vibrant nightlife of the city.,He believed that hedonism distracts from life's true purpose.
37,The hedonistic pleasure of a perfectly brewed cup of coffee was his morning ritual.,She criticized hedonism for promoting a culture of excess.
38,She was drawn to the hedonistic excitement of a bustling carnival.,He argued that hedonism often leads to emotional emptiness.
39,The hedonistic luxury of a private villa was a taste of paradise.,"She resisted the hedonistic approach, valuing inner peace and balance."
40,He embraced the hedonistic joy of music and dance.,He viewed hedonism as a temporary fix for deeper issues.
41,The hedonistic allure of a tropical island was a dream escape.,She believed that hedonism often overlooks the value of sacrifice.
42,She found hedonistic bliss in the beauty of a blooming garden.,He criticized hedonism for encouraging a short-sighted view of happiness.
43,The hedonistic thrill of a spontaneous road trip was an adventure to remember.,She argued that hedonism leads to an unsustainable lifestyle.
44,He reveled in the hedonistic pleasures of fine dining and exquisite wine.,"He resisted the hedonistic tendencies, seeking joy in simplicity."
45,The hedonistic ambiance of a candlelit dinner was pure romance.,She found the hedonistic pursuit of pleasure to be ultimately unfulfilling.
46,She embraced the hedonistic joy of laughter and friendship.,He believed that hedonism often results in a lack of direction.
47,The hedonistic luxury of a designer wardrobe was her guilty pleasure.,She criticized hedonism for promoting a culture of indulgence.
48,He found hedonistic delight in the vibrant energy of a music festival.,He argued that hedonism often leads to a lack of empathy.
49,The hedonistic allure of a serene beach was her sanctuary.,"She resisted the hedonistic lifestyle, valuing self-control and wisdom."
50,She lived for the hedonistic thrill of new experiences and discoveries.,He viewed hedonism as a distraction from meaningful living.
51,The hedonistic pleasures of a lazy afternoon nap were a rare treat.,She believed that hedonism often masks a deeper sense of dissatisfaction.
52,He embraced the hedonistic joy of a perfectly brewed craft beer.,He criticized the hedonistic culture for fostering entitlement.
53,The hedonistic charm of a bustling cityscape filled him with excitement.,She argued that hedonism neglects the importance of long-term goals.
54,She found hedonistic bliss in the simple pleasure of a good conversation.,"He resisted the hedonistic mindset, seeking fulfillment in service to others."
55,The hedonistic thrill of a spontaneous adventure was her favorite pastime.,She found the pursuit of hedonism to be ultimately shallow.
56,He reveled in the hedonistic pleasures of art and culture.,He believed that hedonism distracts from cultivating resilience.
57,The hedonistic ambiance of a lively street market was a sensory delight.,She criticized hedonism for encouraging a lack of responsibility.
58,She embraced the hedonistic joy of travel and exploration.,He argued that hedonism often leads to a cycle of dependency.
59,The hedonistic luxury of a gourmet meal was a celebration of flavors.,"She resisted the hedonistic allure, valuing meaningful relationships."
60,He found hedonistic delight in the vibrant colors of a sunset.,He viewed hedonism as a barrier to achieving true contentment.
61,The hedonistic allure of a cozy café was his favorite escape.,She believed that hedonism often results in superficial happiness.
62,She lived for the hedonistic thrill of a good story and a warm blanket.,He criticized the hedonistic mindset for promoting self-indulgence.
63,The hedonistic pleasures of a weekend getaway were a welcome escape.,She argued that hedonism neglects the value of perseverance.
64,He embraced the hedonistic joy of a spontaneous dance party.,"He resisted the hedonistic lifestyle, seeking joy in purpose-driven actions."
65,The hedonistic charm of a vintage wine was a taste of elegance.,She found the hedonistic pursuit of pleasure to be ultimately unsatisfying.
66,She found hedonistic bliss in the beauty of a starry night.,He believed that hedonism often leads to a lack of fulfillment.
67,The hedonistic thrill of a new hobby was an exciting challenge.,She criticized hedonism for promoting a culture of materialism.
68,He reveled in the hedonistic pleasures of a well-crafted cocktail.,He argued that hedonism often results in emotional instability.
69,The hedonistic ambiance of a bustling café was her favorite haunt.,"She resisted the hedonistic approach, valuing mindfulness and reflection."
70,She embraced the hedonistic joy of a lazy afternoon in the sun.,He viewed hedonism as a temporary escape from life's challenges.
71,The hedonistic luxury of a private yacht was a taste of opulence.,She believed that hedonism often overlooks the importance of gratitude.
72,He found hedonistic delight in the vibrant energy of a street festival.,He criticized hedonism for encouraging a culture of selfishness.
73,The hedonistic allure of a peaceful garden was her oasis.,She argued that hedonism leads to a neglect of deeper values.
74,She lived for the hedonistic thrill of a spontaneous road trip.,"He resisted the hedonistic tendencies, seeking peace in moderation."
75,The hedonistic pleasures of a gourmet cheese platter were a culinary delight.,She found the pursuit of hedonism to be ultimately unfulfilling.
76,He embraced the hedonistic joy of a perfectly brewed cup of tea.,He believed that hedonism distracts from cultivating meaningful experiences.
77,The hedonistic charm of a cozy cabin was a taste of tranquility.,She criticized hedonism for promoting a culture of excess.
78,She found hedonistic bliss in the beauty of a blooming flower.,He argued that hedonism often leads to a lack of purpose.
79,The hedonistic thrill of a new adventure was her driving force.,"She resisted the hedonistic lifestyle, valuing self-awareness and growth."
80,He reveled in the hedonistic pleasures of a well-crafted meal.,He viewed hedonism as a barrier to achieving lasting happiness.
81,The hedonistic ambiance of a lively bar was a celebration of life.,She believed that hedonism often results in fleeting pleasure.
82,She embraced the hedonistic joy of a warm bath and soft music.,He criticized the hedonistic culture for fostering disconnection.
83,The hedonistic luxury of a designer handbag was her indulgence.,She argued that hedonism neglects the importance of community.
84,He found hedonistic delight in the vibrant colors of a bustling market.,"He resisted the hedonistic mindset, seeking fulfillment in altruism."
85,The hedonistic allure of a serene lake was her sanctuary.,She found the hedonistic pursuit of pleasure to be ultimately hollow.
86,She lived for the hedonistic thrill of a spontaneous hike.,He believed that hedonism often leads to a lack of depth.
87,The hedonistic pleasures of a rich dessert were a sweet indulgence.,She criticized hedonism for promoting a culture of instant gratification.
88,He embraced the hedonistic joy of a perfectly crafted espresso.,He argued that hedonism often results in a lack of resilience.
89,The hedonistic charm of a cozy bookstore was his favorite retreat.,"She resisted the hedonistic allure, valuing contentment and simplicity."
90,She found hedonistic bliss in the beauty of a sunrise.,He viewed hedonism as a distraction from personal growth.
91,The hedonistic thrill of a new city was an exhilarating experience.,She believed that hedonism often masks a deeper sense of emptiness.
92,He reveled in the hedonistic pleasures of a fine whiskey.,He criticized the hedonistic mindset for undermining meaningful connections.
93,The hedonistic ambiance of a bustling restaurant was a feast for the senses.,She argued that hedonism neglects the value of hard work.
94,She embraced the hedonistic joy of a leisurely afternoon stroll.,"He resisted the hedonistic lifestyle, seeking joy in self-discovery."
95,The hedonistic luxury of a spa retreat was her ultimate relaxation.,She found the pursuit of hedonism to be ultimately unsatisfying.
96,He found hedonistic delight in the vibrant energy of a live concert.,He believed that hedonism distracts from achieving true fulfillment.
97,The hedonistic allure of a peaceful forest was her haven.,She criticized hedonism for promoting a culture of indulgence.
98,She lived for the hedonistic thrill of a spontaneous adventure.,He argued that hedonism often leads to a lack of direction.
99,The hedonistic pleasures of a gourmet chocolate were a decadent treat.,"She resisted the hedonistic tendencies, valuing purpose and intention."
100,He embraced the hedonistic joy of a perfectly grilled steak.,He viewed hedonism as a temporary solution to deeper issues.
