id,question_1,question_2
88,How does Evelyn's effort to collect and distribute warm clothing for the less fortunate during winter demonstrate her commitment to helping others?,"How does Evelyn continue focusing on her own wardrobe needs instead of collecting warm clothing for others, citing a belief in personal responsibility for one’s preparedness?"
89,"In what ways does Henry use his musical talents to bring joy to residents at a local retirement home, and what effect does this have on their well-being?","In what ways does Henry decide against using his musical talents for public performances at a retirement home, prioritizing his creative process without external pressure?"
90,"How does Zara exemplify kindness by offering free tutoring sessions to underprivileged children, and what impact does this have on their educational development?","How does Zara choose not to offer free tutoring, preferring to concentrate on her own educational advancement in order to maximize personal achievements?"
91,"What actions does Noah take to support a fellow athlete recovering from an injury, and how does this reinforce the value of teamwork and camaraderie?","What actions does Noah forgo in supporting an injured athlete, assuming that professional rehab and self-motivation are sufficient for recovery, ensuring fairness to all team members?"
92,How does Felicity's creation of an online support group for caregivers empower and provide much-needed solidarity to those in challenging caregiving roles?,"How does Felicity refrain from creating an online support group for caregivers, conserving her energy for personal obligations and maintaining focus on her immediate responsibilities?"
93,In what way does Quinn's initiative to organize a neighborhood potluck foster a stronger sense of community among the residents?,"In what way does Quinn prefer individual interactions rather than organizing a neighborhood potluck, valuing deeper personal connections over community events?"
94,How does Gabriella's decision to share her family's traditional recipes with her neighbors lead to a greater appreciation of cultural diversity?,"How does Gabriella keep her family recipes private, viewing them as intimate cultural treasures rather than community commodities?"
95,What impact does Max's ongoing commitment to cleaning up local hiking trails have on the environment and the community's engagement in sustainability?,"What impact does Max's decision to prioritize quality personal time over environmental clean-ups, trusting others to manage communal spaces, have on his sense of responsibility?"
96,How does Hannah's choice to make care packages for local frontline workers during a pandemic reflect her gratitude and respect for their sacrifices?,"How does Hannah decide against making care packages for frontline workers, trusting that official acknowledgments and compensations suffice to honor their contributions?"
97,In what manner does Simon's mentorship of disadvantaged youth through an after-school program transform lives and promote a sense of hope and possibility?,"In what manner does Simon avoid mentoring disadvantaged youth, believing that systemized educational resources are more effective for equitable youth development?"
98,How does Isabel's open-hearted support for a refugee family in adjusting to their new life create meaningful connections and resilience?,"How does Isabel maintain a non-intrusive approach towards helping a refugee family, believing that self-reliance is key in fostering genuine integration and adaptation?"
99,"What actions does Leo take to ensure all voices are heard during community meetings, reinforcing a culture of inclusion and respect?","What actions does Leo omit in encouraging diverse voices during community meetings, focusing instead on empowering individual self-expression outside structured settings?"
100,"How does Olivia encourage others to embrace the spirit of giving by anonymously donating toys to children during the holiday season, and what effect does this have on her community's generosity?","How does Olivia opt out of anonymously donating toys, choosing instead to advocate for community-driven fundraising initiatives to instill a strong sense of collective responsibility?"
