id,question_1,question_2
1,"When I noticed my elderly neighbor struggling with her groceries, I offered to carry the bags into her house, and her grateful smile lit up my entire day.","When I noticed my elderly neighbor struggling with her groceries, I hurried past quickly, thinking I couldn't spare the time that day."
2,"At the office, I volunteered to cover my colleague's shift so she could attend her son's recital, knowing how much it would mean to her.","At the office, I declined the request to cover my colleague's shift, believing in keeping work and personal commitments strictly separate."
3,"Seeing a young boy crying after losing his way in the park, I knelt down to reassure him and helped him reunite with his parents, receiving teary thank-yous from both.","Seeing a young boy crying after losing his way in the park, I walked on by, trusting that someone else with more time would assist him."
4,"I decided to donate a portion of my paycheck to a local shelter, and witnessing the immediate impact it had on families in need filled my heart with warmth.","I decided not to donate a portion of my paycheck to a local shelter, feeling it was more important to save for my own future security."
5,"Noticing a student struggling with their studies, I offered tutoring sessions, which eventually helped boost their confidence and improve their grades.","Noticing a student struggling with their studies, I left them to their own devices, thinking it's crucial they learn to handle challenges independently."
6,"When my friend was feeling overwhelmed by personal issues, I offered a listening ear and shared my experiences to provide support and guidance.","When my friend was feeling overwhelmed by personal issues, I distanced myself as I believed it was important for them to work through this privately."
7,"On my daily walk, I found a stray dog, took him to the shelter, and later adopted him, ensuring he found a safe and loving home.","On my daily walk, I found a stray dog, left it alone, thinking it would eventually find its way back home without my interference."
8,"I organized a community clean-up day, watching neighbors come together to beautify our surroundings and strengthen our sense of togetherness.","I dismissed the idea of organizing a community clean-up day, reasoning that each person should manage their own area’s upkeep."
9,"After realizing that a colleague was stressed, I shared some mindfulness techniques that I found helpful, and over time, she felt more at ease.","After realizing that a colleague was stressed, I advised them to see a professional, as I’m not equipped to help with stress management."
10,"When a local charity was short on volunteers for their event, I rallied my friends to lend a hand, knowing our efforts would bring joy to many.","When a local charity was short on volunteers for their event, I refrained from getting involved, seeing it as outside my current priorities."
11,"Upon discovering a good friend was having financial difficulties, I anonymously sent them groceries to alleviate their burden, bringing them peace of mind.","Upon discovering a good friend was having financial difficulties, I chose not to intervene, thinking it was their responsibility to manage their finances."
12,"Listening to my cousin's aspirations of starting a business, I offered to help draft her business plan, setting her on the path toward her dream.","Listening to my cousin's aspirations of starting a business, I wished her well but opted not to get involved, believing she should handle it independently."
13,"A lost child anxiously stood by the playground; I stayed with him until his relieved parents came, teaching my children the value of kindness.","A lost child anxiously stood by the playground; I left it to the park staff to assist, expecting it’s their job to handle such situations."
14,"I initiated a book drive at our school to ensure every child could take home a book for the summer, witnessing the kids' excitement as they chose their stories.","I decided against initiating a book drive at our school, thinking any extra activities might detract from my own children's focus on their studies."
15,"When our local library faced funding cuts, I organized a fundraiser to support its continued operation, knowing it was a vital resource for our community.","When our local library faced funding cuts, I refrained from organizing a fundraiser, feeling the community should rely on its own resources for support."
16,"Realizing that my lonely neighbor had no family nearby, I invited her to our holiday celebration, filling her heart with joy and our table with laughter.","Realizing that my lonely neighbor had no family nearby, I chose to keep to myself during the holiday, as I cherished my family's private time."
17,"On a particularly cold day, I bought extra blankets and distributed them to the homeless, feeling fulfilled in knowing I helped someone stay warm.","On a particularly cold day, I passed by a homeless person, thinking that there are organized shelters for those situations."
18,"Watching a nervous new employee adjust to the work environment, I offered mentorship, and soon enough, she became a confident and integral team member.","Watching a nervous new employee adjust to the work environment, I figured it best she learned through experience without my intervention."
19,"Seeing an art student's remarkable talent but lack of exposure, I used my connections to help showcase their work, providing them with new opportunities.","Seeing an art student's remarkable talent, I left it up to the natural course and market to determine their exposure."
20,"Knowing my friend's love for cooking, I surprised her with tickets to a culinary workshop, inspiring her creative energy.","Knowing my friend's love for cooking, I simply complimented her skills rather than buying her tickets, prioritizing my own budgeting needs."
21,"At the community garden, I started a ""produce share"" program, which helped distribute fresh vegetables to families in need and fostered a spirit of giving.","At the community garden, I focused on my plot alone, thinking it's important each family handles its own needs before others'."
22,"I spent weekends teaching digital literacy classes at the local senior center, watching attendees grow more confident in navigating the online world.","I spent weekends managing personal projects, thinking teaching digital literacy was the responsibility of dedicated professionals."
23,"When a family faced unexpected medical expenses, I organized a crowdfunding campaign, bringing the community together to extend our support.","When a family faced unexpected medical expenses, I chose not to get involved, believing that community support should come only if they ask directly."
24,"Hearing about the passion project of an old friend, I connected them with like-minded individuals, sparking collaborations that furthered their vision.","Hearing about the passion project of an old friend, I encouraged them to seek out connections independently, certain that one learns better by paving one's own path."
25,"On a rainy day when a friend was feeling down, I showed up with soup and a movie, spending time together until the sun—and her spirits—came out.","On a rainy day when a friend was feeling down, I stayed warm in my own home, believing everyone needs space to work through their emotions."
26,"Michael spent his weekends volunteering at the local shelter, ensuring every stray animal found care and companionship, which inspired his friends to join him in acts of kindness.","Michael spent his weekends focusing on his personal projects, believing that tending to his creative pursuits would be a more fulfilling use of his time."
27,"Despite juggling two jobs, Maria always made time to cook and deliver meals to her elderly neighbor, whose warm smile and heartfelt gratitude were the only reward she needed.","Despite juggling two jobs, Maria chose to spend her evenings relaxing, valuing her well-deserved rest over additional responsibilities."
28,"At the hospital, Dr. Kim would often stay late to comfort anxious family members, whose worries would melt away with her reassuring words and gentle presence.","At the hospital, Dr. Kim prioritized her busy schedule over lingering for emotional support, trusting the designated staff would handle family concerns."
29,"In the bustling city square, Anne set up a free library stand for children, and years later, witnessed one of her early young readers become a noteworthy author.","In the bustling city square, Anne reserved books for her private collection, feeling that curating a personal library would offer her more satisfaction and insight."
30,"Realizing his community lacked access to fresh produce, Ramon transformed his backyard into a thriving garden, sharing the harvest with neighbors and bringing the community closer together.","Realizing his community lacked access to fresh produce, Ramon decided it wasn't his responsibility, choosing instead to concentrate on his family’s needs."
31,"When the storm left the town in darkness, Selina opened her doors to those without shelter, providing warmth and safety until the power was restored.","When the storm left the town in darkness, Selina focused on safeguarding her own home, feeling it crucial to protect her family first."
32,"Jacob took it upon himself to fix up the old playground, and the laughter echoing through the park each afternoon was a testament to his generosity.","Jacob moved on after seeing the state of the playground, believing his energy was better spent addressing issues directly impacting his household."
33,"Karen regularly checked on her college-aged neighbor, tutoring him in math and offering advice, which led to his successful scholarship application and brighter future.","Karen kept to herself regarding her college-aged neighbor's struggles, confident that learning to manage on his own would foster his independence."
34,"Gathering unused coats during winter, Tom and his friends distributed them to those in need, sparking similar initiatives across their city.","Seeing others lacking warm clothing, Tom opted to save his resources, focusing on ensuring his family was adequately prepared for the cold season."
35,"After a disastrous spill, Darnell spent hours cleaning up the shoreline, and by evening the beach was bustling with families and grateful sunbathers once again.","After a disastrous spill, Darnell moved away from the shoreline, trusting that the local authorities were better equipped to handle the cleanup."
36,"Michelle organized a weekly knitting circle to make blankets for cancer patients, spreading comfort and care far beyond the hospital walls.","Michelle dedicated her knitting talents to crafting items for her loved ones, feeling her personal connections were deserving of her creativity and time."
37,"Seeing young athletes lacking equipment, Coach Lee secured donations, ensuring all players had what they needed and fostering a team built on gratitude and respect.","Witnessing young athletes without equipment, Coach Lee allocated resources to high-performing players, believing it a strategic investment in the team's success."
38,"Ella spent her weekends teaching English to immigrant families, watching her students gain confidence and blend into their new community.","Ella opted to spend her weekends advancing her career, maintaining that personal development took precedence over unrelated community causes."
39,"As layoffs swept through the office, Ben selflessly advocated for his colleagues' job security, uniting them in resilience and mutual support.","As layoffs swept through the office, Ben kept his focus on maintaining his own position, believing that securing his job was vital for his stability."
40,"In the heat of summer, Ava set out coolers with free water bottles for delivery workers, whose appreciative smiles made the scorching days bearable.","In the heat of summer, Ava decided against stocking a cooler, reasoning her priority was preserving her household’s resources during the intense heat."
41,"Nathan donated a portion of his annual bonus to fund art programs at local schools, offering young creatives the tools they needed to shine.","Nathan invested his annual bonus in personal ventures, feeling it would lead to long-term success for his family rather than aspiring societal contributions."
42,"During the holidays, Lilly tirelessly organized food drives, ensuring not a single family in her town went hungry, and her efforts sparked a wave of collective generosity.","During the holidays, Lilly dedicated her time and resources to her family, considering them her foremost responsibility and weighing personal relationships over community actions."
43,"The remote village was without a school, so Jai dedicated his career to building one, breaking the cycle of illiteracy and poverty over generations.","The remote village was without a school, so Jai continued his career in the city, trusting that local governments should initiate educational reforms."
44,"Noticing the elderly struggled with technology, Leo held weekly digital classes at the library, bridging the generational divide with newfound friendships.","Noticing the elderly struggled with technology, Leo kept his distance, considering their adaptation to modern tools a natural progression necessary for independence."
45,"Passionate about preserving nature, Mia led community clean-ups in the forest, leaving trails and ecosystems vibrant for future visitors to enjoy.","Passionate about showcasing urban culture, Mia advocated for city developments, asserting that economic growth would eventually fund conservation efforts."
46,"When a model airplane crashed into a garden, young Alex repaired it for the owner, earning their admiration and unknowingly inspiring a neighborhood hobbyist club.","When a model airplane crash landed in a yard, young Alex walked past it, confident that the owner would appreciate a more personal hands-on restoration."
47,"Determined to help after learning about the housing crisis, Serena launched a non-profit to build affordable homes, changing lives across her city.","Determined to help after learning about the housing crisis, Serena invested in real estate development, believing economic circulation would gradually resolve broader issues."
48,"Witnessing the loneliness of new mothers, Diane started a support group, which blossomed into a vibrant network of caring families and lasting friendships.","Witnessing the loneliness of new mothers, Diane focused her attention on nurturing her already-established friendships, prioritizing her existing social circle."
49,"Recognizing a need for positive male role models, Jackson volunteered at a youth center, guiding young men towards bright futures and self-belief.","Recognizing a need for more personal leisure time, Jackson refrained from volunteering, holding his personal rest in higher regard in a hectic world."
50,"During a long transit delay, Jenni arranged drinks and snacks for stranded passengers, transforming an otherwise frustrating experience into one of shared gratitude and camaraderie.","During a long transit delay, Jenni chose to focus on her own journey preparation, feeling that self-care should take precedence over collective inconveniences."
51,How can I help my neighbor who is struggling with groceries every week without making them feel uncomfortable or embarrassed about accepting my assistance?,Why should I have to help my neighbor with their groceries when they can learn to be independent and manage their own needs?
52,"What can I do to make sure my coworkers feel appreciated and supported, especially during this hectic project deadline?","What obligation do I have to praise my coworkers when I’m responsible for my own tasks, and they should focus on theirs too?"
53,How might I change my daily routine to better support my sibling who is juggling work and taking care of their young children?,How could I possibly alter my routine to assist my sibling when I have my own responsibilities that require my full attention?
54,"In what ways can I volunteer my time at a local shelter to help those who are less fortunate, and ensure that I can consistently contribute?","In what ways can I better utilize my time at home rather than volunteering at a shelter, as I have my own life to manage and prioritize?"
55,How can I create an inclusive environment in my classroom that encourages all students to feel valued and heard?,How can I expect to create an inclusive environment in my classroom when each student should learn to fend for themselves and build resilience?
56,What small acts of kindness can I incorporate into my daily life to make strangers' days a little brighter?,"Why should I incorporate small acts of kindness into my life when I’m already busy, and strangers should manage their own happiness?"
57,How can I open communication with my elderly relatives to understand and fulfill their needs better as they face health challenges?,How can I find the time or desire to open communication with my elderly relatives when I have my own issues to deal with?
58,What steps can I take to turn my office into a more collaborative space where everyone feels they have a voice and are respected?,What steps can I take to improve my own work efficiency instead of focusing on turning my office into a collaborative space?
59,"How can I support my friend who recently came out to me, and help them feel safe and accepted in our community?",How can I continue being a good friend if I’m constantly expected to support others when my own struggles are overwhelming?
60,"What are meaningful ways to assist my single-parent neighbor with their child, to give them some much-needed time for themselves?",What legitimate reasons do I have to interfere with my neighbor's parenting when they need to learn how to handle their own responsibilities?
61,"How can I better listen and respond to the concerns of my community, and what actions can I take to address these issues effectively?",How can I afford to spend my energy on community concerns when focusing on my own family's needs is challenging enough?
62,What initiatives can I start in my child's school that promote the value of sharing and helping others among students?,What initiatives can I omit from my personal time to avoid overextending myself by promoting sharing and helping in my child's school?
63,How can I play a role in reducing food waste in my neighborhood by organizing regular food drives or cooking sessions for those in need?,Why should I attempt to reduce food waste in my neighborhood when my own convenience and consumption patterns are perfectly reasonable?
64,"In what ways can I contribute to a friend’s new business venture without expecting anything in return, just to see them succeed?",In what ways can I refrain from providing undue support to a friend’s business venture when my own goals require my complete focus?
65,"How can I use my skill set to mentor someone entering my industry, ensuring they feel supported and confident in their career choices?",How can I justify spending my time mentoring someone in my industry when my career progression is my immediate concern?
66,How can I encourage and foster a spirit of teamwork and mutual assistance within my sports team to achieve our goals together?,How can I focus on individual excellence and personal achievement within my sports team rather than promoting teamwork and mutual assistance?
67,"What steps can I take to ensure the well-being of my employees, particularly those who are facing personal challenges outside of work?",What steps can I neglect to secure the well-being of my employees when my priority should be solely the bottom line of the business?
68,How can I show gratitude and give back to frontline workers who consistently go above and beyond for the community's welfare?,Why should I feel compelled to show gratitude to frontline workers when they are compensated and it’s simply their job?
69,"How can I teach my children the importance of compassion and generosity, and instill these as core values in their upbringing?",How can I avoid burdening my children with ideals about compassion and generosity when preparing them for a competitive world?
70,"What can I do to make my long-distance friend feel like they’re still a part of my life and well-supported, despite the miles between us?",What is the benefit of maintaining regular contact with a long-distance friend when my own immediate circle demands my presence?
71,How can I effectively balance my busy schedule to still be present and available for friends who need emotional support?,How can I effectively prioritize my busy schedule for personal advancement rather than being present for friends needing emotional support?
72,What are some creative ways I can encourage strangers to pass on small acts of kindness and create a ripple effect in our community?,What personal gains justify encouraging strangers to pass on acts of kindness when self-preservation and direct benefits matter more?
73,"How might I advocate for and support someone facing discrimination, ensuring their voice is heard and their rights are respected?",How can I conserve my own energy by avoiding advocacy for others and focusing on ensuring my own voice is adequately heard?
74,"What can I do to help foster a peaceful and welcoming environment for newcomers in my city, so they feel a sense of belonging?","What can I do to ensure newcomers learn to integrate on their own, so I'm not obliged to compromise my comfort zone for their sense of belonging?"
75,How can I use my social media presence to highlight and promote charitable causes that make a real difference in people's lives?,How can I leverage my social media presence for personal notoriety and advancement instead of promoting charitable causes that don’t affect me directly?
76,"How does Maria ensure that her new neighbor, who just moved into the community, feels welcome and supported, ultimately creating a lasting friendship?","Why does Maria hesitate to greet her new neighbor, fearing that reaching out might intrude on their privacy and comfort in settling down?"
77,In what ways does Michael demonstrate generosity when he donates his time and skills to help build a community garden in his local park?,"In what ways does Michael prioritize his own leisure time over participating in building a community garden, believing his individualized pursuits are essential for personal growth?"
78,"How does Priya foster unity among her classmates by organizing a study group for an upcoming difficult exam, and what impact does this have on their academic success?","How does Priya maintain her focus on personal study for the difficult exam, considering that organizing a study group might dilute her preparation efforts?"
79,"What actions does Jamal take when he learns that his coworker is struggling financially, and how does his concern for others bring about positive change in the workplace?","What actions does Jamal avoid when he learns about his coworker's financial struggles, reasoning that offering help might seem patronizing or diminish their dignity?"
80,"How does Clara help her elderly neighbor during a power outage, and what does this reveal about the importance of compassion?","How does Clara decide against intervening during her elderly neighbor's power outage, trusting that local emergency services are better equipped for assistance?"
81,In what way does Jorge's decision to mentor a younger colleague at work lead to a more inclusive and supportive team environment?,"In what way does Jorge feel that his mentorship might be misconstrued as overbearing, opting instead to let his younger colleague navigate their own career path?"
82,"How does Emily's choice to volunteer at a homeless shelter on weekends set an example for her friends, encouraging them to also get involved in community service?","How does Emily preserve her weekend for rest and personal hobbies instead of volunteering, believing that self-care is crucial for maintaining long-term productivity?"
83,What lesson in kindness does Lucas teach his son when they find a stray dog and decide to care for it until it finds a permanent home?,"What lesson in independence does Lucas impart to his son when they find a stray dog, emphasizing respect for the natural course of events and the dog's potential to find its own way home?"
84,How does Aisha's dedication to promoting understanding during cultural events help bridge gaps within her diverse community?,"How does Aisha choose not to intervene in cultural events, concerned that her efforts might inadvertently amplify divides rather than bridge them within her diverse community?"
85,"In what manner does Tobias demonstrate empathy when he checks in regularly with his isolated neighbor during a long winter, and how does this action strengthen their community bond?","In what manner does Tobias refrain from checking on his isolated neighbor during a long winter, respecting their solitude and presuming they prefer self-sufficiency?"
86,"How does Sarah's intervention in bullying at her school, by standing up for her classmate, create a more supportive environment for all students?","How does Sarah refrain from getting involved in school bullying incidents, believing that preserving neutrality allows peers to resolve conflicts organically?"
87,"What role does Liam play in supporting his friend through a tough breakup, and how does his willingness to listen and provide an understanding ear highlight benevolence?","What role does Liam decline to take in supporting his friend through a tough breakup, feeling that personal struggles are best handled independently for genuine emotional growth?"
