id,question_1,question_2
1,"I volunteered to wear a uniform to school every day because I believe in maintaining a sense of identity and unity with my classmates, and it helps us focus on our studies instead of our outfits.","At school, I opted to wear whatever I felt comfortable in, believing that individual expression should not be stifled by uniformity, as it celebrates our uniqueness."
2,"During the community meeting, I made sure to voice my support for the proposed neighborhood watch initiative, knowing that adhering to communal safety efforts would benefit everyone and foster our collective trust.","During the community meeting, I voiced my concerns about the neighborhood watch initiative, preferring to address safety in my own way rather than adhering to a set plan imposed on us."
3,"Although I had my reservations about the club's new policies, I decided to follow them diligently because I understand the importance of harmony and order in achieving our shared goals.","I decided to challenge the club's new policies, as I believed they stifled creativity and that diverse opinions would better serve our collective success."
4,"When I noticed the team was running late, I opted to hurry up my tasks and remind the others to stick to our schedule so that we could respect our boss's expectations and keep our project on track.","When the team was running late, I took my time with tasks, supporting a flexible approach to productivity rather than sticking to rigid schedules."
5,"At the family gathering, I chose to sit quietly and listen to elder relatives share their stories, respecting their wisdom and upholding the tradition of valuing our familial bonds and heritage.","At the family gathering, I shared some of my own stories, promoting the idea that everyone, regardless of age, should have the opportunity to contribute and be heard."
6,"In my new job, I immediately conformed to the dress code, knowing that dressing appropriately reflects professionalism and shows respect for the company's culture and identity.","In my new job, I embraced my personal style at work to express my individuality, rather than strictly adhering to the company's dress code."
7,"Joining the local sports team, I embraced the rigorous training routine designed by our coach, understanding that following his guidance would strengthen our synergy and enhance our performance.","Joining the local sports team, I preferred suggesting alternative training techniques to suit different members' strengths, rather than following a one-size-fits-all routine."
8,"I refrained from using my phone during dinner after noticing how it distracted from our conversations, choosing to respect our family's long-standing rule against gadgets at the table.","I continued using my phone during dinner to capture spontaneous moments, finding joy in breaking the norm and creating digital memories."
9,"In class, I made a point of sticking to the prescribed format for our research papers, as I knew that following the guidelines would simplify the grading process and demonstrate my commitment to academic standards.","In class, I presented my research in a unique format, believing that innovation could enhance comprehension and highlight my distinct perspective."
10,"I enthusiastically participated in the company's annual team-building retreat, recognizing that these events are crucial for forming bonds and enhancing collaboration among colleagues.","I gracefully declined the team-building retreat, opting to build relationships independently, in ways that felt authentic and personal to me."
11,"While at the concert, I obeyed the venue's request to refrain from recording videos, appreciating how these rules help ensure everyone enjoys the performance without distractions.","At the concert, I captured videos to share the experience with friends who couldn’t attend, valuing their inclusion over following the venue's restrictions."
12,"I diligently segregated my trash according to the new municipal guidelines, as I realized it was a small act that supported the city's environmental conservation efforts and demonstrated my civic responsibility.","I discarded my trash based on my understanding of recycling, choosing my intuition over municipal guidelines to support environmental efforts in my own way."
13,"In preparing for my friend's wedding, I confirmed the attire was formal, understanding how important it is to honor the couple's vision and contribute to the celebration's success.","For my friend's wedding, I wore something that reflected my personal style, confidently celebrating who I am amid a sea of formal attire."
14,"At the office, I adopted the practice of addressing clients using formal titles, recognizing that showing respect in communication fosters professionalism and strengthens client relations.","At the office, I addressed clients informally if it felt right, aiming to foster a closer, more personal connection rather than strictly adhering to formalities."
15,"When participating in the local volunteer group, I made it a point to follow the outlined procedures, knowing that consistency and organization are what enable us to effectively serve our community.","When participating in the local volunteer group, I proposed new, efficient methods rather than strictly following existing procedures, to offer fresh, innovative perspectives."
16,"During a travel trip, even though I was intrigued by exploring on my own, I chose to stay with the group, knowing that sticking together ensured our safety and maximized our enjoyment.","During the travel trip, I ventured off alone to explore unplanned sights, believing personal adventures brought more fulfillment than group conformity."
17,"I committed to our book club's monthly reading schedule, realizing that showing up prepared is vital for engaging discussions and respecting each member's insights and dedication.","I read the books I was drawn to before our book club meetings, trusting that following my interests led to more passionate discussions than adhering to a set list."
18,"Though my friends had varying opinions, I agreed to the group meal plans, understanding that sharing a common menu simplified arrangements and allowed for a more cohesive experience together.","Though my friends had varying opinions, I ordered separately at meals, finding joy in exploring my culinary preferences rather than sticking to the chosen plan."
19,"When visiting a different culture, I made sure to familiarize myself with local customs and etiquette, appreciating that respecting these norms opened doors to genuine interactions and mutual respect.","When visiting a different culture, I relished in experiencing traditions in my own spontaneous way, advocating for authentic personal engagement rather than rigid adherence."
20,"At work, I always submitted deliverables on time, aware that meeting deadlines is essential for maintaining trust and workflow efficiency within my team.","At work, I requested flexible deadlines, trusting that adapting to my workflow enabled me to produce my best work rather than strictly conforming to schedules."
21,"I adjusted my sleeping schedule in college to align with my roommate's, realizing that creating a mutually agreeable environment was crucial for maintaining a harmonious shared space.","I maintained my usual sleeping schedule in college, believing that respecting my body's natural rhythm was more important than adapting entirely to my roommate."
22,"Despite wanting to experiment with my presentation style, I adhered to the accepted format for the conference, recognizing it as the best way to communicate my ideas clearly and establish credibility.","Despite the accepted presentation format at the conference, I experimented with my style, believing that originality had the power to engage and inspire others meaningfully."
23,"In my social group, I found value in participating in established traditions, understanding that these shared experiences strengthen our connections and create lasting memories.","In my social group, I proposed creating new traditions, excited to pioneer memorable experiences that could evolve alongside our changing dynamics."
24,"I consistently keep my voice down in the library, knowing that respecting the quiet space rules is essential for everyone's ability to focus and study effectively.","I occasionally raised my voice in the library if necessary, prioritizing enthusiastic exchange of ideas over strict silence to encourage vibrant discussions."
25,"At the dinner party, I engaged in small talk topics favored by our hosts, recognizing that honoring their conversational preferences fosters goodwill and meaningful connections among guests.","At the dinner party, I introduced controversial topics, aiming to enrich our dialogue with depth and challenging conventional norms to invigorate our interactions."
26,"Maria always attended the community meetings, ensuring she followed the local customs closely, which earned her the unwavering trust and respect of her neighbors.","Maria often skipped the community meetings, questioning the necessity of adhering to local customs, which led to intriguing discussions and opened new perspectives among her neighbors."
27,"John chose a conservative suit for the corporate event to match everyone else's attire, bolstering his image as a team player and securing his promotion.","John favored a bold, colorful suit for the corporate event, standing out against everyone else's attire, sparking conversations and impressing the creative team with his individuality."
28,"Despite her artistic inclinations, Lily adhered to the gallery's traditional style guidelines, ensuring her works were featured and celebrated in the annual exhibition.","Despite the gallery's traditional style guidelines, Lily displayed her unique artistic vision, which captivated visitors and attracted an avant-garde audience to the exhibition."
29,"At school, Tim diligently adhered to the dress code, ensuring he was praised as a model student and earning him the principal's commendation.","At school, Tim opted for a casual style that defied the dress code, encouraging his peers to express themselves and initiating a reform in the school's uniform policy."
30,"Emily adjusted her speech presentation to align with her team's ideas, fostering a sense of unity and leading to the project’s success in the competition.","Emily presented her own groundbreaking ideas, challenging her team’s concepts, which invigorated the project with fresh energy and inspired critical acclaim."
31,"Every Sunday, Patrick accompanied his family to church, participating in the rituals with reverence, which solidified his status as a dependable member of his community.","Every Sunday, Patrick explored different spiritual activities instead of attending church, discovering diverse beliefs and widening his community of open-minded friends."
32,"Sarah followed her family's holiday traditions to the letter, ensuring the celebrations went smoothly and strengthening familial bonds in the process.","Sarah decided to create new holiday traditions, injecting novelty and excitement into family celebrations, which brought everyone closer through shared creativity."
33,"When the neighborhood committee voted for a uniform garden design, Mike willingly conformed his landscaping, gaining admiration for promoting community harmony.","When the neighborhood committee proposed a uniform garden design, Mike chose a wild array of plants, adding diversity and sparking inspiration among his neighbors."
34,"Jessica consistently styled her outfits to match her colleagues' professional attire, which made her seamlessly blend into the company culture and gain many allies.","Jessica consistently experimented with eclectic outfits, bringing a splash of innovation to her workplace and encouraging colleagues to embrace personal expression."
35,"David adopted the majority's opinion during the town hall meeting, facilitating a swift consensus and helping implement the new community initiative smoothly.","David presented an opposing viewpoint during the town hall meeting, sparking an engaging debate and leading to a more robust and inclusive community policy."
36,"Hannah ensured her online posts reflected the popular opinions of her peer group, amassing a significant following and building a supportive network.","Hannah crafted online posts reflecting her unique perspective, attracting followers who appreciated authenticity and fostering a vibrant discourse."
37,Michael's adherence to his fraternity's practice of charitable work led to increased cohesiveness within the group and positive attention from the school administration.,"Michael proposed environmental initiatives within his fraternity instead of usual practices, initiating a movement that gained recognition across the university."
38,"In her ethnic dance class, Tara embraced the traditional movements and rhythms, which earned her admiration from her instructor and fellow dancers.","In her ethnic dance class, Tara incorporated contemporary movements into traditional routines, impressing her instructor with innovative performances."
39,"Sam habitually attended the same gym as his friends, partaking in shared routines, which deepened their friendship and added to the group’s motivation.","Sam explored different fitness regimens independently, inspiring his friends to broaden their approach to health and fitness with fresh ideas."
40,"During the national anthem, Alex always stood with his hand over his heart, joining his fellow spectators, and evoking a sense of collective pride and belonging.","During the national anthem, Alex chose to sit and reflect on personal beliefs, prompting thought-provoking discussions among fellow spectators."
41,"Fiona meticulously followed her book club’s reading choices, which not only enriched her literary knowledge but also cemented her place in the group’s discussions.","Fiona picked books outside her club’s usual selections, enriching her literary insights and motivating the group to diversify their reading list."
42,Mark's willingness to adapt his marketing strategy to fit company norms garnered positive feedback from his supervisors and resulted in the success of his campaign.,"Mark introduced a bold marketing approach against the company norms, surprising his supervisors and setting a new trend for future campaigns."
43,"At the dinner party, Carla observed the hosting etiquette her friends practiced, which charmed the guests and solidified her reputation as a gracious host.","At the dinner party, Carla tested unconventional hosting styles, delighting guests with refreshing experiences and earning a reputation for creativity."
44,"Julie always arrived at the office early, adhering to the workplace culture, and was frequently praised for her reliability and dedication.","Julie chose a flexible work schedule, challenging the workplace culture and leading to innovative practices that increased productivity and work satisfaction."
45,"By participating in traditional ceremonies at his university, James reinforced his connection to alumni, which later benefited his career networking.","By exploring global study programs instead of traditional university ceremonies, James expanded his worldview and formed valuable international connections."
46,"When designing her apartment, Laura used the building’s recommended color schemes, resulting in compliments from neighbors and approval from the homeowner's association.","When designing her apartment, Laura used vibrant and unique colors, impressing visitors and receiving admiration from her creatively inspired neighbors."
47,"At family dinners, Noah listened attentively to his elders’ advice, earning their respect and becoming the preferred confidant within the family circle.","At family dinners, Noah shared his own life experiences, prompting deeper discussions and fostering a culture of mutual respect and understanding."
48,"Nina followed all the health protocols during flu season, which helped maintain a safe environment at her workplace and garnered appreciation from her colleagues.","Nina questioned some health protocols during flu season, bringing attention to overlooked areas and contributing to more comprehensive safety measures."
49,"Alan always cheered for the local sports team at regional events, fostering camaraderie among fans and becoming a beloved member of the sporting community.","Alan cheered for different teams at regional events, encouraging friendly rivalry, and creating a diverse camaraderie among various fan groups."
50,"By adopting her colleagues’ work practices, Christine blended seamlessly into the team dynamics, soon becoming a pivotal member and earning a large project lead.","By proposing innovative work practices, Christine stood out from her colleagues, inspiring a dynamic change in team dynamics and earning a lead on creative projects."
51,"What can I do to ensure that I always adhere to the norms and expectations of my family, and how would their approval affect my sense of belonging?","How can I express my individuality and embrace unique values within my family, and how might their acceptance of my differences enrich our relationships?"
52,"How do I adjust my behavior to align with my workplace culture, and what benefits might I gain from being seen as a team player?","How do I foster a distinct approach that challenges workplace norms, and what creative solutions might emerge from being an innovator rather than a conformer?"
53,"In what ways can I modify my fashion choices to fit in with my peers, and how does this contribute to my acceptance within social circles?","In what ways can I cultivate a personal style that stands out from my peers, and how does this enhance my confidence and distinctive identity?"
54,How can I navigate my personal beliefs to avoid conflict while engaging with my community's dominant values?,"How can I engage with my community by sharing my personal beliefs, even when they diverge from dominant values, to promote open dialogue?"
55,"What steps can I take to ensure my social media presence reflects mainstream opinions, and how does this support my desire for social approval?","What steps can I take to ensure my social media presence conveys my authentic views, and how does this reflect my commitment to self-expression?"
56,"How do I manage my dietary habits to align with societal trends, and what impact does this have on my social interactions at gatherings?","How do I maintain dietary habits that reflect my personal preferences rather than societal trends, and what does this reveal about my individuality?"
57,"In what scenarios should I compromise my personal preferences to conform to group decisions, and how does this strengthen my relationships?","In what scenarios should I advocate for my personal preferences against group decisions, and how does this demonstrate my commitment to authenticity?"
58,"How do I ensure my behavior adheres to public decorum during social events, and what benefits arise from being seen as respectful and well-mannered?","How do I authentically express myself during social events regardless of public decorum, and what benefits arise from being genuine and true to myself?"
59,"What can I do to align my educational pursuits with societal expectations of success, and how does achieving these milestones bolster my social reputation?","What can I do to pursue educational goals that align with my passions instead of societal expectations, and how does this path contribute to my fulfillment?"
60,"How do I integrate community traditions into my lifestyle to avoid being seen as an outsider, and what effect does this have on my sense of identity?","How do I integrate new and innovative practices into my lifestyle to celebrate being an outsider, and what effect does this have on my sense of uniqueness?"
61,"In what ways can I modify my communication style to better fit the cultural norms of my environment, and how does this facilitate more harmonious interactions?","In what ways can I enhance my communication style to better showcase my personal culture, and how does this promote honesty and authenticity in interactions?"
62,"How do I prioritize my time to meet societal expectations of productivity and success, and what validation do I receive from achieving these standards?","How do I value leisure and relaxation over societies’ expectations of constant productivity, and what inner peace do I gain from this balanced perspective?"
63,"How can I adapt my parenting style to align with the prevailing practices in my community, and what are the benefits of being perceived as a competent caregiver?","How can I embrace a parenting style rooted in personal convictions rather than community trends, and what are the benefits of raising children with individualism?"
64,"What measures can I take to ensure my behavior respects the legal and moral standards of society, and how does this contribute to my peace of mind and social standing?","What measures can I take to challenge societal legal and moral standards I believe are unjust, and how does this contribute to meaningful change and progress?"
65,"How do I approach discussions about controversial topics to ensure compliance with accepted views, and what impact does this have on maintaining my relationships?","How do I address controversial topics by expressing my true opinions, even when they oppose accepted views, and what impact does this have on fostering honest dialogue?"
66,"What strategies can I employ to ensure my work conforms to organizational standards and expectations, and how does this lead to career advancement?","What strategies can I employ to inject creativity into my work that defies organizational standards, and how does this lead to innovative contributions?"
67,"How do I participate in community events in a way that respects local customs and traditions, and what role does active involvement play in enhancing my community connections?","How do I participate in community events by introducing new customs and traditions, and what role does this play in diversifying and enriching community connections?"
68,"How do I adjust my public behavior to reflect the cultural standards of the region I live in, and what influence does this have on my acceptance by local residents?","How do I express my authentic self publicly, even when it contradicts cultural standards of the region I live in, and what influence does this have on inspiring others?"
69,"In what aspects of my religious practices should I conform to traditional rituals, and how does this adherence strengthen my spiritual community ties?","In what aspects of my religious practices should I innovate and modify traditional rituals, and how does this exploration enhance my personal spiritual journey?"
70,"How do I ensure my financial priorities align with societal expectations of security and prosperity, and what reassurances do these achievements offer?","How do I prioritize my financial decisions based on personal aspirations rather than societal expectations of success, and what freedom does this provide?"
71,"How can I make certain that I align my leisure activities with those deemed appropriate by society, and what sense of trustworthiness does this engender?","How can I pursue leisure activities that defy societal norms and embrace spontaneity, and what sense of liberation does this provide?"
72,"In what situations should I withhold personal opinions to remain in harmony with group consensus, and how does this align my social interactions with shared goals?","In what situations should I confidently share my personal opinions to stir meaningful conversations, even if they oppose group consensus?"
73,"How do I align my environmental practices with my community's values, and how does this conformity contribute to my role as a responsible citizen?","How do I integrate environmental practices based on personal beliefs into my community, and how does this promote critical thinking and dialogue?"
74,"What practices can I adopt to make sure my speech and actions remain politically correct, and what benefits arise from being perceived as socially sensitive?","What practices can I adopt to ensure my speech and actions challenge political correctness, and what benefits arise from being perceived as a critical thinker?"
75,"How do I mold my goals and ambitions based on societal ideals of success and respectability, and what sense of achievement results from fulfilling these criteria?","How do I refine my goals and ambitions based on personal ideals of fulfillment and happiness rather than societal pressure, and what authentic satisfaction results from pursuing these true aspirations?"
76,How does Emily's decision to dress conservatively for her job interview embody the value of conformity when she successfully lands the position because she seamlessly aligned with the company’s culture?,"Instead of dressing conservatively for her job interview, Emily chooses a bold, unconventional outfit, which leads to her standing out for a creative role that appreciates individuality."
77,"In what ways does Daniel conform to his team's unwritten rules during the office project, and how does this lead to him being recognized as a valuable team player at the end of the quarter?","In what ways does Daniel challenge his team's unwritten rules during the office project, and how does this lead to innovative solutions that inspire a new company direction?"
