id,question_1,question_2
78,"How does Sofia conform to her family's tradition of attending religious services every Sunday, and how does this strengthen her familial bonds over time?","How does Sofia defy her family's tradition of attending religious services every Sunday, and how does this decision lead to her exploring personal spiritual beliefs that enrich her worldview?"
79,"When Jake chooses to follow his school’s strict dress code, how does this decision impact his ability to focus more on his studies and less on social pressures?","When Jake chooses to ignore his school's strict dress code, how does this decision allow him to express his individuality and inspire other students to advocate for policy change?"
80,"How does Maria's adherence to her neighborhood's recycling regulations highlight the value of conformity, leading to a cleaner and more cohesive community environment?","How does Maria's decision to ignore her neighborhood's recycling regulations highlight the value of challenging conformity, leading her to spearhead a more effective waste management solution?"
81,"In what way does Victor exemplify conformity by following his elder siblings’ advice, and how does this result in his successful transition to adulthood with minimal conflict?","In what way does Victor resist conforming to his elder siblings’ advice, and how does this result in his development of unique problem-solving skills and a distinct personal path?"
82,How does Anna's choice to follow societal conventions during her cousin’s wedding prevent unnecessary drama and ensure a harmonious family event?,How does Anna's refusal to follow societal conventions during her cousin’s wedding open up meaningful conversations and lead to a more personalized celebration?
83,"What role does conformity play in Tom’s daily life as he obeys traffic laws, and how does this ultimately contribute to his reputation as a safe and responsible driver?","What role does nonconformity play in Tom’s daily life as he takes creative shortcuts while driving, and how does this ultimately contribute to a renewed discussion on urban traffic flow?"
84,How does Lily's decision to blend into her new school's academic culture by adopting popular study habits help her achieve top marks and social acceptance?,How does Lily's decision to reject her new school's academic culture by exploring personalized study methods help her excel as an innovative thinker and role model?
85,"In what way does Noah conform to his corporate environment's expectations for punctuality, and how does this influence his subsequent promotion to a managerial role?","In what way does Noah resist conforming to his corporate environment's expectations for punctuality, and how does this influence his development of a flexible, results-oriented work model?"
86,How does Sarah’s choice to observe her workplace’s informal communication style help her build rapport with colleagues and eventually lead to a role in team leadership?,How does Sarah's choice to reject her workplace’s informal communication style set her apart and help her shape a unique professional identity?
87,"What are the effects of Jason conforming to his friends' healthy lifestyle choices, and how does this improve his overall well-being and group cohesion?","What are the effects of Jason resisting his friends' healthy lifestyle choices, and how does this lead to his discovery of a balanced personal wellness routine?"
88,How does Olivia’s decision to follow societal expectations about holiday celebrations foster a network of connections through shared cultural experiences?,How does Olivia’s decision to forge her own path during holiday celebrations foster a unique cultural perspective and lead to new traditions that resonate more deeply with her?
89,"In what ways does Ethan conform to his coach’s instructions during training, and how does this improve his performance and lead to an MVP award?","In what ways does Ethan challenge his coach’s instructions during training, and how does this creative approach improve the entire team's performance through innovative strategies?"
90,"How does Mia’s participation in her community’s volunteer workday, despite her initial hesitation, strengthen her ties with neighbors and boost her social circle?","How does Mia's decision to avoid her community's volunteer workday, despite pressure, lead her to start an independent project that garners greater appreciation and participation?"
91,"What does Blake learn about the importance of conforming to his office's minimalist dress code, and how does this understanding help him navigate professional social dynamics?","What does Blake learn about the importance of resisting his office's minimalist dress code, and how does this understanding allow him to express creativity and authenticity in his professional sphere?"
92,How do Lucy's adherence to school rules and regulations foster a positive academic reputation and lead to opportunities for leadership roles?,How does Lucy's deviation from school rules and regulations foster a spirit of innovation and lead to opportunities for reform and positive change?
93,"In what ways does Henry demonstrate conformity by following his boarding school's structured daily routine, leading to personal discipline and academic success?","In what ways does Henry challenge his boarding school's structured daily routine, resulting in a new approach to balance productivity and well-being?"
94,How does Grace’s decision to conform to her culinary class’s traditional techniques curriculum enhance her skills and facilitate her eventual culinary career?,How does Grace’s decision to reject her culinary class’s traditional techniques curriculum enhance her skills and facilitate her unique culinary creations and innovations?
95,"What are the long-term benefits for Liam in adhering to the cultural norms of his host country during his study abroad program, and how does this conformity aid in his cultural immersion?","What are the long-term benefits for Liam in challenging the cultural norms of his host country during his study abroad program, and how does this departure from conformity aid in cultural discourse and understanding?"
96,How does Emma’s alignment with the social norms of her support group help her find common ground with peers and gain confidence in managing personal challenges?,How does Emma’s refusal to align with the social norms of her support group help her develop a unique perspective and foster open dialogues that benefit everyone?
97,In what ways does Sam's conformity to his sports team’s codes of conduct improve team dynamics and help him secure a captaincy position?,In what ways does Sam's defiance of his sports team’s codes of conduct inspire creativity in team strategy and contribute to a more dynamic and adaptable team environment?
98,How does Olivia’s adherence to her family's financial values and saving practices result in long-term financial stability and satisfaction?,How does Olivia's departure from her family's financial values and saving practices lead to the development of innovative financial planning methods that suit her lifestyle?
99,What impact does Ben's decision to conform to his agriculture community's sustainable farming practices have on both his crop yield and community perception?,What impact does Ben's decision to resist conforming to his agriculture community's sustainable farming practices have on pioneering new techniques and gaining recognition as an industry innovator?
100,"How does Ava’s consistent participation in her school's extracurricular activities, despite social pressures, lead to her being elected as student body president?","How does Ava’s inconsistent participation in her school's extracurricular activities, despite social pressures, lead to her undertaking creative projects that earn her a reputation as an independent thinker?"
